{
  "schema_version": "0.1",
  "protocol_id": "SEMANTIC_SURFACE_SUCCESSOR_PROTOCOL_0_1",
  "stimulus_id": "ST_b94e44c450e911748891aea3385e5b77",
  "input_blobs": [
    {
      "input_id": "IN_03e373bdfb33ecfb4519fea2069fcb2b",
      "media_type": "application/json",
      "content_encoding": "UTF-8",
      "transfer_encoding": "BASE64",
      "sha256": "df8153eada178d70aaaab5edfe8b5bc66663f00b017b36b22527d85be84fb0c5",
      "byte_length": 47,
      "source": "INLINE",
      "content_base64": "eyJmYWN0cyI6eyJkMyI6Imo3In0sInJlcXVlc3QiOnsibG9va3VwIjoiZDMifX0=",
      "artifact_ref": null
    }
  ],
  "invocation": {
    "dispatch_token": "OP_66b75c2f0c4468bfcecd2bd3798b7292",
    "transport": "STDIN",
    "ordered_input_ids": ["IN_03e373bdfb33ecfb4519fea2069fcb2b"]
  }
}
