{
  "schema_version": "0.1",
  "protocol_id": "SEMANTIC_SURFACE_SUCCESSOR_PROTOCOL_0_1",
  "stimulus_id": "ST_3e780756c06afaa10e1ae15b06830532",
  "input_blobs": [
    {
      "input_id": "IN_b72555bc1fed5befbb433e82089300a3",
      "media_type": "application/json",
      "content_encoding": "UTF-8",
      "transfer_encoding": "BASE64",
      "sha256": "f474cc4d996182778f591860089fc913d94fdace5457d0c1d26f4a57ec074deb",
      "byte_length": 47,
      "source": "INLINE",
      "content_base64": "eyJmYWN0cyI6eyJrNyI6InYzIn0sInJlcXVlc3QiOnsibG9va3VwIjoiazcifX0=",
      "artifact_ref": null
    }
  ],
  "invocation": {
    "dispatch_token": "OP_03f05e9ae877f1f4089e9befa63f6955",
    "transport": "STDIN",
    "ordered_input_ids": ["IN_b72555bc1fed5befbb433e82089300a3"]
  }
}
